{
  "schema": 1,
  "modVersion": "0.3.0",
  "build": 100001,
  "name": "SYNTH DISPLAY SDF",
  "family": "Synth Display",
  "atlas": {
    "file": "graystroke.png",
    "width": 64,
    "height": 64,
    "padding": 4,
    "spread": 5.0,
    "pointSize": 36,
    "encoding": "sdf-alpha"
  },
  "face": {
    "lineHeight": 44.0,
    "ascent": 34.0,
    "descent": -10.0,
    "scale": 1.0,
    "tabWidth": 20.0
  },
  "glyphs": [
    {
      "unicode": 32,
      "x": 0,
      "y": 0,
      "w": 0,
      "h": 0,
      "bearingX": 0.0,
      "bearingY": 0.0,
      "advance": 12.0
    },
    {
      "unicode": 65,
      "x": 4,
      "y": 4,
      "w": 24,
      "h": 28,
      "bearingX": 1.0,
      "bearingY": 28.0,
      "advance": 26.0
    },
    {
      "unicode": 66,
      "x": 32,
      "y": 4,
      "w": 22,
      "h": 28,
      "bearingX": 2.0,
      "bearingY": 28.0,
      "advance": 24.0
    }
  ],
  "kerning": [
    {
      "first": 65,
      "second": 66,
      "x": -1.5
    }
  ]
}
